{
 "version": 1,
 "scope": "lights",
 "season": "christmas",
 "year": 2026,
 "dataAt": "2026-12-10T16:55:00.000000Z",
 "stale": false,
 "pageComplete": true,
 "mirror": {
  "state": "confirmed",
  "confirmedAt": "2026-12-10T15:00:00.000000Z",
  "heldSince": null,
  "heldCount": 0
 },
 "region": {
  "tz": "America/Los_Angeles",
  "localBox": {
   "minLat": 39.1,
   "maxLat": 39.5,
   "minLng": -120.47,
   "maxLng": -119.88
  }
 },
 "count": 12,
 "nextCursor": null,
 "attribution": {
  "name": "TruckeeVibes",
  "url": "https://truckeevibes.com/"
 },
 "events": [
  {
   "id": "00000000-0000-4000-8000-0c0000000002",
   "origin": "lights",
   "formerIds": [],
   "pageUrl": null,
   "title": "Holiday Lights Trail",
   "description": "A mile of lights along the park trail, every night through the holidays.",
   "summary": null,
   "startsAt": "2026-11-28T01:00:00Z",
   "endsAt": "2027-01-04T06:00:00Z",
   "allDay": false,
   "startDate": null,
   "endDate": null,
   "timeKnown": true,
   "venue": "Regional Park",
   "address": "10500 Brockway Rd, Truckee, CA 96161",
   "town": null,
   "lat": 39.318,
   "lng": -120.17,
   "categories": [],
   "age": "unknown",
   "adultsOnly": false,
   "url": "https://example.org/lights-trail",
   "ticketUrl": null
  },
  {
   "id": "00000000-0000-4000-8000-0c0000000001",
   "origin": "lights",
   "formerIds": [],
   "pageUrl": null,
   "title": "Cookies with Santa",
   "description": "Cookies, cocoa and a photo with Santa.",
   "summary": null,
   "startsAt": "2026-12-10T18:00:00Z",
   "endsAt": "2026-12-10T20:00:00Z",
   "allDay": false,
   "startDate": null,
   "endDate": null,
   "timeKnown": true,
   "venue": "Truckee Library",
   "address": "10031 Levon Ave, Truckee, CA 96161",
   "town": null,
   "lat": 39.326,
   "lng": -120.185,
   "categories": [],
   "age": "unknown",
   "adultsOnly": false,
   "url": "https://example.org/santa-cookies",
   "ticketUrl": null
  },
  {
   "id": "00000000-0000-4000-8000-0c0000000009",
   "origin": "lights",
   "formerIds": [],
   "pageUrl": null,
   "title": "Menorah Lighting",
   "description": "Lighting of the large menorah with music and donuts.",
   "summary": null,
   "startsAt": "2026-12-11T00:30:00Z",
   "endsAt": "2026-12-11T01:30:00Z",
   "allDay": false,
   "startDate": null,
   "endDate": null,
   "timeKnown": true,
   "venue": "Town Square",
   "address": "10046 Church St, Truckee, CA 96161",
   "town": null,
   "lat": 39.3276,
   "lng": -120.1836,
   "categories": [],
   "age": "unknown",
   "adultsOnly": false,
   "url": null,
   "ticketUrl": null
  },
  {
   "id": "00000000-0000-4000-8000-0c0000000003",
   "origin": "lights",
   "formerIds": [],
   "pageUrl": null,
   "title": "Tree Lighting on Commercial Row",
   "description": "Carols, cocoa and the big tree lighting at 6.",
   "summary": null,
   "startsAt": "2026-12-12T01:00:00Z",
   "endsAt": "2026-12-12T03:00:00Z",
   "allDay": false,
   "startDate": null,
   "endDate": null,
   "timeKnown": true,
   "venue": "Commercial Row",
   "address": "10046 Church St, Truckee, CA 96161",
   "town": null,
   "lat": 39.3275,
   "lng": -120.1835,
   "categories": [],
   "age": "unknown",
   "adultsOnly": false,
   "url": null,
   "ticketUrl": null
  },
  {
   "id": "00000000-0000-4000-8000-0c0000000004",
   "origin": "lights",
   "formerIds": [],
   "pageUrl": null,
   "title": "Ugly Sweater Pub Walk",
   "description": "Walk between three bars in your worst sweater. Adults only.",
   "summary": null,
   "startsAt": "2026-12-13T03:00:00Z",
   "endsAt": "2026-12-13T07:00:00Z",
   "allDay": false,
   "startDate": null,
   "endDate": null,
   "timeKnown": true,
   "venue": "Old Town Hall",
   "address": "10040 Bridge St, Truckee, CA 96161",
   "town": null,
   "lat": 39.328,
   "lng": -120.184,
   "categories": [],
   "age": "unknown",
   "adultsOnly": true,
   "url": "https://example.org/sweater-walk",
   "ticketUrl": null
  },
  {
   "id": "00000000-0000-4000-8000-0c0000000005",
   "origin": "lights",
   "formerIds": [],
   "pageUrl": null,
   "title": "Caroling by the Lake",
   "description": "Song sheets are provided. Dress warm.",
   "summary": null,
   "startsAt": "2026-12-14T01:30:00Z",
   "endsAt": null,
   "allDay": false,
   "startDate": null,
   "endDate": null,
   "timeKnown": true,
   "venue": null,
   "address": "Heritage Plaza, Tahoe City, CA",
   "town": null,
   "lat": 39.169,
   "lng": -120.143,
   "categories": [],
   "age": "unknown",
   "adultsOnly": false,
   "url": null,
   "ticketUrl": null
  },
  {
   "id": "00000000-0000-4000-8000-0c0000000006",
   "origin": "vibes",
   "formerIds": [
    "00000000-0000-4000-8000-0f0000000106"
   ],
   "pageUrl": "https://truckeevibes.com/e/winter-craft-market/",
   "title": "Winter Craft Market",
   "description": null,
   "summary": "Local makers sell gifts, cards and ornaments.",
   "startsAt": "2026-12-15T19:00:00Z",
   "endsAt": "2026-12-16T00:00:00Z",
   "allDay": false,
   "startDate": null,
   "endDate": null,
   "timeKnown": true,
   "venue": "Community Rec Center",
   "address": "8924 Donner Pass Rd, Truckee, CA 96161",
   "town": "Truckee",
   "lat": 39.329,
   "lng": -120.201,
   "categories": [
    "halloween-fall"
   ],
   "age": "all_ages",
   "adultsOnly": false,
   "url": null,
   "ticketUrl": null
  },
  {
   "id": "00000000-0000-4000-8000-0c0000000007",
   "origin": "lights",
   "formerIds": [],
   "pageUrl": null,
   "title": "Santa Run Downtown",
   "description": "A 5K fun run in Santa suits.",
   "summary": null,
   "startsAt": "2026-12-19T17:00:00Z",
   "endsAt": "2026-12-19T19:00:00Z",
   "allDay": false,
   "startDate": null,
   "endDate": null,
   "timeKnown": true,
   "venue": "City Plaza",
   "address": "10 N Virginia St, Reno, NV 89501",
   "town": null,
   "lat": 39.5296,
   "lng": -119.8138,
   "categories": [],
   "age": "unknown",
   "adultsOnly": false,
   "url": "https://example.org/santa-run",
   "ticketUrl": null
  },
  {
   "id": "00000000-0000-4000-8000-0c0000000008",
   "origin": "lights",
   "formerIds": [],
   "pageUrl": null,
   "title": "Nutcracker Matinee",
   "description": "The local ballet school dances the Nutcracker.",
   "summary": null,
   "startsAt": "2026-12-19T22:00:00Z",
   "endsAt": "2026-12-20T00:00:00Z",
   "allDay": false,
   "startDate": null,
   "endDate": null,
   "timeKnown": true,
   "venue": "Community Arts Center",
   "address": "10046 Donner Pass Rd, Truckee, CA 96161",
   "town": null,
   "lat": 39.328,
   "lng": -120.19,
   "categories": [],
   "age": "unknown",
   "adultsOnly": false,
   "url": null,
   "ticketUrl": null
  },
  {
   "id": "00000000-0000-4000-8000-0c0000000010",
   "origin": "lights",
   "formerIds": [],
   "pageUrl": null,
   "title": "Light Parade on the Lake",
   "description": "Boats in holiday lights parade past the pier.",
   "summary": null,
   "startsAt": "2026-12-20T02:00:00Z",
   "endsAt": "2026-12-20T04:00:00Z",
   "allDay": false,
   "startDate": null,
   "endDate": null,
   "timeKnown": true,
   "venue": "Lakeside Pier",
   "address": "Commons Beach, Tahoe City, CA",
   "town": null,
   "lat": 39.168,
   "lng": -120.142,
   "categories": [],
   "age": "unknown",
   "adultsOnly": false,
   "url": null,
   "ticketUrl": null
  },
  {
   "id": "00000000-0000-4000-8000-0c0000000011",
   "origin": "lights",
   "formerIds": [],
   "pageUrl": null,
   "title": "Winter Wonderland Skate",
   "description": "Skate under the lights with holiday music.",
   "summary": null,
   "startsAt": "2026-12-26T21:00:00Z",
   "endsAt": "2026-12-27T00:00:00Z",
   "allDay": false,
   "startDate": null,
   "endDate": null,
   "timeKnown": true,
   "venue": "Ice Rink",
   "address": "10500 Brockway Rd, Truckee, CA 96161",
   "town": null,
   "lat": 39.318,
   "lng": -120.17,
   "categories": [],
   "age": "unknown",
   "adultsOnly": false,
   "url": null,
   "ticketUrl": null
  },
  {
   "id": "00000000-0000-4000-8000-0c0000000012",
   "origin": "lights",
   "formerIds": [],
   "pageUrl": null,
   "title": "New Year Glow Walk",
   "description": "A family walk with glow sticks before the fireworks.",
   "summary": null,
   "startsAt": "2026-12-31T23:00:00Z",
   "endsAt": "2027-01-01T01:00:00Z",
   "allDay": false,
   "startDate": null,
   "endDate": null,
   "timeKnown": true,
   "venue": "Riverside Park",
   "address": "10500 River St, Truckee, CA 96161",
   "town": null,
   "lat": 39.324,
   "lng": -120.18,
   "categories": [],
   "age": "unknown",
   "adultsOnly": false,
   "url": null,
   "ticketUrl": null
  }
 ]
}
