{
 "version": 1,
 "scope": "lights",
 "season": "halloween",
 "year": 2026,
 "dataAt": "2026-10-15T14:50:00.000000Z",
 "stale": false,
 "pageComplete": true,
 "mirror": {
  "state": "confirmed",
  "confirmedAt": "2026-10-15T14:48:00.000000Z",
  "heldSince": null,
  "heldCount": 0
 },
 "region": {
  "tz": "America/Los_Angeles",
  "localBox": {
   "minLat": 39.1,
   "maxLat": 39.5,
   "minLng": -120.47,
   "maxLng": -119.88
  }
 },
 "count": 12,
 "nextCursor": null,
 "attribution": {
  "name": "TruckeeVibes",
  "url": "https://truckeevibes.com/"
 },
 "events": [
  {
   "id": "00000000-0000-4000-8000-0a0000000002",
   "origin": "lights",
   "formerIds": [],
   "pageUrl": null,
   "title": "Haunted Depot Walk",
   "description": "A short lantern walk past the old depot every night of October.",
   "summary": null,
   "startsAt": "2026-10-03T01:00:00Z",
   "endsAt": "2026-11-02T06:00:00Z",
   "allDay": false,
   "startDate": null,
   "endDate": null,
   "timeKnown": true,
   "venue": "Truckee Depot",
   "address": "10046 Church St, Truckee, CA 96161",
   "town": null,
   "lat": 39.3274,
   "lng": -120.1838,
   "categories": [],
   "age": "unknown",
   "adultsOnly": false,
   "url": "https://example.org/depot-walk",
   "ticketUrl": null
  },
  {
   "id": "00000000-0000-4000-8000-0a0000000001",
   "origin": "lights",
   "formerIds": [],
   "pageUrl": null,
   "title": "Pumpkin Patch Story Time",
   "description": "Stories, songs and a small pumpkin for every child.\nBring a blanket.",
   "summary": null,
   "startsAt": "2026-10-15T17:00:00Z",
   "endsAt": "2026-10-15T18:30:00Z",
   "allDay": false,
   "startDate": null,
   "endDate": null,
   "timeKnown": true,
   "venue": "Truckee Library",
   "address": "10031 Levon Ave, Truckee, CA 96161",
   "town": null,
   "lat": 39.326,
   "lng": -120.185,
   "categories": [],
   "age": "unknown",
   "adultsOnly": false,
   "url": "https://example.org/story-time",
   "ticketUrl": null
  },
  {
   "id": "00000000-0000-4000-8000-0a0000000003",
   "origin": "lights",
   "formerIds": [],
   "pageUrl": null,
   "title": "Trunk or Treat at the Rec Center",
   "description": "Decorated car trunks and candy for kids in costume.",
   "summary": null,
   "startsAt": "2026-10-17T23:00:00Z",
   "endsAt": "2026-10-18T01:00:00Z",
   "allDay": false,
   "startDate": null,
   "endDate": null,
   "timeKnown": true,
   "venue": "Community Rec Center",
   "address": "8924 Donner Pass Rd, Truckee, CA 96161",
   "town": null,
   "lat": 39.329,
   "lng": -120.201,
   "categories": [],
   "age": "unknown",
   "adultsOnly": false,
   "url": null,
   "ticketUrl": null
  },
  {
   "id": "00000000-0000-4000-8000-0a0000000004",
   "origin": "lights",
   "formerIds": [],
   "pageUrl": null,
   "title": "Monster Mash Night",
   "description": "A costume dance with a live band. Adults only.",
   "summary": null,
   "startsAt": "2026-10-18T04:00:00Z",
   "endsAt": "2026-10-18T08:00:00Z",
   "allDay": false,
   "startDate": null,
   "endDate": null,
   "timeKnown": true,
   "venue": "Old Town Hall",
   "address": "10040 Bridge St, Truckee, CA 96161",
   "town": null,
   "lat": 39.328,
   "lng": -120.184,
   "categories": [],
   "age": "unknown",
   "adultsOnly": true,
   "url": "https://example.org/monster-mash",
   "ticketUrl": null
  },
  {
   "id": "00000000-0000-4000-8000-0a0000000005",
   "origin": "lights",
   "formerIds": [],
   "pageUrl": null,
   "title": "Spooky Story Night",
   "description": "Ghost stories by the lake for the whole family.",
   "summary": null,
   "startsAt": "2026-10-20T01:30:00Z",
   "endsAt": null,
   "allDay": false,
   "startDate": null,
   "endDate": null,
   "timeKnown": true,
   "venue": null,
   "address": "Heritage Plaza, Tahoe City, CA",
   "town": null,
   "lat": 39.169,
   "lng": -120.143,
   "categories": [],
   "age": "unknown",
   "adultsOnly": false,
   "url": null,
   "ticketUrl": null
  },
  {
   "id": "00000000-0000-4000-8000-0a0000000006",
   "origin": "vibes",
   "formerIds": [
    "00000000-0000-4000-8000-0f0000000006"
   ],
   "pageUrl": "https://truckeevibes.com/e/fall-harvest-market/",
   "title": "Fall Harvest Market",
   "description": null,
   "summary": "A market day with local farm stands and cider.",
   "startsAt": "2026-10-20T22:00:00Z",
   "endsAt": "2026-10-21T02:00:00Z",
   "allDay": false,
   "startDate": null,
   "endDate": null,
   "timeKnown": true,
   "venue": "Riverside Park",
   "address": "10500 River St, Truckee, CA 96161",
   "town": "Truckee",
   "lat": 39.324,
   "lng": -120.18,
   "categories": [
    "halloween-fall"
   ],
   "age": "all_ages",
   "adultsOnly": false,
   "url": null,
   "ticketUrl": null
  },
  {
   "id": "00000000-0000-4000-8000-0a0000000008",
   "origin": "lights",
   "formerIds": [],
   "pageUrl": null,
   "title": "Costume Contest at the Brewery",
   "description": "Prizes for the best group costume.",
   "summary": null,
   "startsAt": "2026-10-25T00:00:00Z",
   "endsAt": "2026-10-25T03:00:00Z",
   "allDay": false,
   "startDate": null,
   "endDate": null,
   "timeKnown": true,
   "venue": "Mill Street Brewhouse",
   "address": "10100 Mill St, Truckee, CA 96161",
   "town": null,
   "lat": 39.327,
   "lng": -120.186,
   "categories": [],
   "age": "unknown",
   "adultsOnly": false,
   "url": null,
   "ticketUrl": null
  },
  {
   "id": "00000000-0000-4000-8000-0a0000000007",
   "origin": "lights",
   "formerIds": [],
   "pageUrl": null,
   "title": "Zombie Crawl Downtown",
   "description": "Walk the river path in your best zombie look.",
   "summary": null,
   "startsAt": "2026-10-25T02:00:00Z",
   "endsAt": "2026-10-25T06:00:00Z",
   "allDay": false,
   "startDate": null,
   "endDate": null,
   "timeKnown": true,
   "venue": "City Plaza",
   "address": "10 N Virginia St, Reno, NV 89501",
   "town": null,
   "lat": 39.5296,
   "lng": -119.8138,
   "categories": [],
   "age": "unknown",
   "adultsOnly": false,
   "url": "https://example.org/zombie-crawl",
   "ticketUrl": null
  },
  {
   "id": "00000000-0000-4000-8000-0a0000000010",
   "origin": "lights",
   "formerIds": [],
   "pageUrl": null,
   "title": "Haunted House by the Lake",
   "description": "A walk-through haunted house. Not for small children.",
   "summary": null,
   "startsAt": "2026-10-31T02:00:00Z",
   "endsAt": "2026-10-31T05:00:00Z",
   "allDay": false,
   "startDate": null,
   "endDate": null,
   "timeKnown": true,
   "venue": "Lakeside Cabin",
   "address": "15000 Donner Pass Rd, Truckee, CA 96161",
   "town": null,
   "lat": 39.323,
   "lng": -120.235,
   "categories": [],
   "age": "unknown",
   "adultsOnly": false,
   "url": null,
   "ticketUrl": null
  },
  {
   "id": "00000000-0000-4000-8000-0a0000000009",
   "origin": "lights",
   "formerIds": [],
   "pageUrl": null,
   "title": "Kids Halloween Parade",
   "description": "Line up at 10:45 for the parade down the street.",
   "summary": null,
   "startsAt": "2026-10-31T18:00:00Z",
   "endsAt": "2026-10-31T19:00:00Z",
   "allDay": false,
   "startDate": null,
   "endDate": null,
   "timeKnown": true,
   "venue": "Commercial Row",
   "address": "10046 Church St, Truckee, CA 96161",
   "town": null,
   "lat": 39.3275,
   "lng": -120.1835,
   "categories": [],
   "age": "unknown",
   "adultsOnly": false,
   "url": null,
   "ticketUrl": null
  },
  {
   "id": "00000000-0000-4000-8000-0a0000000012",
   "origin": "lights",
   "formerIds": [],
   "pageUrl": null,
   "title": "Glow Pumpkin Float",
   "description": "Lit pumpkins float across the pond at dusk.",
   "summary": null,
   "startsAt": "2026-11-01T01:00:00Z",
   "endsAt": "2026-11-01T04:00:00Z",
   "allDay": false,
   "startDate": null,
   "endDate": null,
   "timeKnown": true,
   "venue": "West End Beach",
   "address": "14000 South Shore Dr, Truckee, CA 96161",
   "town": null,
   "lat": 39.32,
   "lng": -120.24,
   "categories": [],
   "age": "unknown",
   "adultsOnly": false,
   "url": null,
   "ticketUrl": null
  },
  {
   "id": "00000000-0000-4000-8000-0a0000000011",
   "origin": "lights",
   "formerIds": [],
   "pageUrl": null,
   "title": "Day of the Dead Altar Walk",
   "description": "Visit the community altars and add a photo of your own.",
   "summary": null,
   "startsAt": "2026-11-02T01:00:00Z",
   "endsAt": "2026-11-02T04:00:00Z",
   "allDay": false,
   "startDate": null,
   "endDate": null,
   "timeKnown": true,
   "venue": "Community Arts Center",
   "address": "10046 Donner Pass Rd, Truckee, CA 96161",
   "town": null,
   "lat": 39.328,
   "lng": -120.19,
   "categories": [],
   "age": "unknown",
   "adultsOnly": false,
   "url": null,
   "ticketUrl": null
  }
 ]
}
